Item Name,Purpose,Link,Cost (USD),Quantity
Wheel,For locomotion,https://www.pololu.com/product/3281/specs,,4
Motor,To drive each wheel,https://www.pololu.com/product/4845/resources,,4
Bevel Gears,To redirect torque at a 90-degree angle,https://www.amazon.com/dp/B0DFCQ85HG,,4
Shaft,Connects motor to gear/wheel,https://www.servocity.com/4mm-shaft-stainless-steel-100mm-length/,,4
Ball Bearings,To support rotating shafts,https://www.servocity.com/4mm-id-x-12mm-od-flanged-ball-bearing-2-pack/,,4
IMU Sensor,For measuring orientation/terrain detection,https://www.adafruit.com/product/2472,,1
Motor Drivers,To control motor speed/direction,https://www.pololu.com/product/2999,,2
Raspberry Pi Pico,Main microcontroller,https://www.amazon.com/dp/B0DPF9N1MN,,1
